{
  "$schema": "../../schemas/tune.schema.json",
  "schema_version": "0.2.0",
  "id": "ps1650.tune.selma",
  "title": "Selma",
  "alternate_title": null,
  "meter": "6.6.8.6",
  "ppq": 480,
  "default_bpm": 84,
  "time_signature": [
    4,
    4
  ],
  "key": "E-flat major",
  "length_ticks": 15360,
  "notes": [
    {
      "id": "ps1650.tune.selma.phrase-01.note-01",
      "midi": 63,
      "start_tick": 0,
      "duration_ticks": 480,
      "velocity": 88
    },
    {
      "id": "ps1650.tune.selma.phrase-01.note-02",
      "midi": 67,
      "start_tick": 480,
      "duration_ticks": 480,
      "velocity": 88
    },
    {
      "id": "ps1650.tune.selma.phrase-01.note-03",
      "midi": 65,
      "start_tick": 960,
      "duration_ticks": 480,
      "velocity": 88
    },
    {
      "id": "ps1650.tune.selma.phrase-01.note-04",
      "midi": 63,
      "start_tick": 1440,
      "duration_ticks": 480,
      "velocity": 88
    },
    {
      "id": "ps1650.tune.selma.phrase-01.note-05",
      "midi": 65,
      "start_tick": 1920,
      "duration_ticks": 240,
      "velocity": 88
    },
    {
      "id": "ps1650.tune.selma.phrase-01.note-06",
      "midi": 67,
      "start_tick": 2160,
      "duration_ticks": 240,
      "velocity": 88
    },
    {
      "id": "ps1650.tune.selma.phrase-01.note-07",
      "midi": 70,
      "start_tick": 2400,
      "duration_ticks": 1440,
      "velocity": 88
    },
    {
      "id": "ps1650.tune.selma.phrase-02.note-01",
      "midi": 70,
      "start_tick": 3840,
      "duration_ticks": 480,
      "velocity": 88
    },
    {
      "id": "ps1650.tune.selma.phrase-02.note-02",
      "midi": 72,
      "start_tick": 4320,
      "duration_ticks": 480,
      "velocity": 88
    },
    {
      "id": "ps1650.tune.selma.phrase-02.note-03",
      "midi": 70,
      "start_tick": 4800,
      "duration_ticks": 480,
      "velocity": 88
    },
    {
      "id": "ps1650.tune.selma.phrase-02.note-04",
      "midi": 67,
      "start_tick": 5280,
      "duration_ticks": 480,
      "velocity": 88
    },
    {
      "id": "ps1650.tune.selma.phrase-02.note-05",
      "midi": 70,
      "start_tick": 5760,
      "duration_ticks": 360,
      "velocity": 88
    },
    {
      "id": "ps1650.tune.selma.phrase-02.note-06",
      "midi": 72,
      "start_tick": 6120,
      "duration_ticks": 120,
      "velocity": 88
    },
    {
      "id": "ps1650.tune.selma.phrase-02.note-07",
      "midi": 72,
      "start_tick": 6240,
      "duration_ticks": 1440,
      "velocity": 88
    },
    {
      "id": "ps1650.tune.selma.phrase-03.note-01",
      "midi": 72,
      "start_tick": 7680,
      "duration_ticks": 480,
      "velocity": 88
    },
    {
      "id": "ps1650.tune.selma.phrase-03.note-02",
      "midi": 70,
      "start_tick": 8160,
      "duration_ticks": 480,
      "velocity": 88
    },
    {
      "id": "ps1650.tune.selma.phrase-03.note-03",
      "midi": 72,
      "start_tick": 8640,
      "duration_ticks": 240,
      "velocity": 88
    },
    {
      "id": "ps1650.tune.selma.phrase-03.note-04",
      "midi": 75,
      "start_tick": 8880,
      "duration_ticks": 240,
      "velocity": 88
    },
    {
      "id": "ps1650.tune.selma.phrase-03.note-05",
      "midi": 75,
      "start_tick": 9120,
      "duration_ticks": 480,
      "velocity": 88
    },
    {
      "id": "ps1650.tune.selma.phrase-03.note-06",
      "midi": 70,
      "start_tick": 9600,
      "duration_ticks": 480,
      "velocity": 88
    },
    {
      "id": "ps1650.tune.selma.phrase-03.note-07",
      "midi": 72,
      "start_tick": 10080,
      "duration_ticks": 480,
      "velocity": 88
    },
    {
      "id": "ps1650.tune.selma.phrase-03.note-08",
      "midi": 67,
      "start_tick": 10560,
      "duration_ticks": 480,
      "velocity": 88
    },
    {
      "id": "ps1650.tune.selma.phrase-03.note-09",
      "midi": 65,
      "start_tick": 11040,
      "duration_ticks": 480,
      "velocity": 88
    },
    {
      "id": "ps1650.tune.selma.phrase-04.note-01",
      "midi": 63,
      "start_tick": 11520,
      "duration_ticks": 480,
      "velocity": 88
    },
    {
      "id": "ps1650.tune.selma.phrase-04.note-02",
      "midi": 65,
      "start_tick": 12000,
      "duration_ticks": 240,
      "velocity": 88
    },
    {
      "id": "ps1650.tune.selma.phrase-04.note-03",
      "midi": 67,
      "start_tick": 12240,
      "duration_ticks": 240,
      "velocity": 88
    },
    {
      "id": "ps1650.tune.selma.phrase-04.note-04",
      "midi": 70,
      "start_tick": 12480,
      "duration_ticks": 480,
      "velocity": 88
    },
    {
      "id": "ps1650.tune.selma.phrase-04.note-05",
      "midi": 65,
      "start_tick": 12960,
      "duration_ticks": 480,
      "velocity": 88
    },
    {
      "id": "ps1650.tune.selma.phrase-04.note-06",
      "midi": 65,
      "start_tick": 13440,
      "duration_ticks": 480,
      "velocity": 88
    },
    {
      "id": "ps1650.tune.selma.phrase-04.note-07",
      "midi": 63,
      "start_tick": 13920,
      "duration_ticks": 1440,
      "velocity": 88
    }
  ],
  "phrases": [
    {
      "id": "ps1650.tune.selma.phrase-01",
      "start_tick": 0,
      "end_tick": 3840,
      "note_ids": [
        "ps1650.tune.selma.phrase-01.note-01",
        "ps1650.tune.selma.phrase-01.note-02",
        "ps1650.tune.selma.phrase-01.note-03",
        "ps1650.tune.selma.phrase-01.note-04",
        "ps1650.tune.selma.phrase-01.note-05",
        "ps1650.tune.selma.phrase-01.note-06",
        "ps1650.tune.selma.phrase-01.note-07"
      ]
    },
    {
      "id": "ps1650.tune.selma.phrase-02",
      "start_tick": 3840,
      "end_tick": 7680,
      "note_ids": [
        "ps1650.tune.selma.phrase-02.note-01",
        "ps1650.tune.selma.phrase-02.note-02",
        "ps1650.tune.selma.phrase-02.note-03",
        "ps1650.tune.selma.phrase-02.note-04",
        "ps1650.tune.selma.phrase-02.note-05",
        "ps1650.tune.selma.phrase-02.note-06",
        "ps1650.tune.selma.phrase-02.note-07"
      ]
    },
    {
      "id": "ps1650.tune.selma.phrase-03",
      "start_tick": 7680,
      "end_tick": 11520,
      "note_ids": [
        "ps1650.tune.selma.phrase-03.note-01",
        "ps1650.tune.selma.phrase-03.note-02",
        "ps1650.tune.selma.phrase-03.note-03",
        "ps1650.tune.selma.phrase-03.note-04",
        "ps1650.tune.selma.phrase-03.note-05",
        "ps1650.tune.selma.phrase-03.note-06",
        "ps1650.tune.selma.phrase-03.note-07",
        "ps1650.tune.selma.phrase-03.note-08",
        "ps1650.tune.selma.phrase-03.note-09"
      ]
    },
    {
      "id": "ps1650.tune.selma.phrase-04",
      "start_tick": 11520,
      "end_tick": 15360,
      "note_ids": [
        "ps1650.tune.selma.phrase-04.note-01",
        "ps1650.tune.selma.phrase-04.note-02",
        "ps1650.tune.selma.phrase-04.note-03",
        "ps1650.tune.selma.phrase-04.note-04",
        "ps1650.tune.selma.phrase-04.note-05",
        "ps1650.tune.selma.phrase-04.note-06",
        "ps1650.tune.selma.phrase-04.note-07"
      ]
    }
  ],
  "harmony": {
    "voicing": "SATB",
    "voices": {
      "alto": [
        {
          "id": "ps1650.tune.selma.harmony.alto.note-01",
          "midi": 58,
          "start_tick": 0,
          "duration_ticks": 480,
          "velocity": 88
        },
        {
          "id": "ps1650.tune.selma.harmony.alto.note-02",
          "midi": 63,
          "start_tick": 480,
          "duration_ticks": 480,
          "velocity": 88
        },
        {
          "id": "ps1650.tune.selma.harmony.alto.note-03",
          "midi": 62,
          "start_tick": 960,
          "duration_ticks": 480,
          "velocity": 88
        },
        {
          "id": "ps1650.tune.selma.harmony.alto.note-04",
          "midi": 63,
          "start_tick": 1440,
          "duration_ticks": 480,
          "velocity": 88
        },
        {
          "id": "ps1650.tune.selma.harmony.alto.note-05",
          "midi": 62,
          "start_tick": 1920,
          "duration_ticks": 480,
          "velocity": 88
        },
        {
          "id": "ps1650.tune.selma.harmony.alto.note-06",
          "midi": 62,
          "start_tick": 2400,
          "duration_ticks": 1440,
          "velocity": 88
        },
        {
          "id": "ps1650.tune.selma.harmony.alto.note-07",
          "midi": 63,
          "start_tick": 3840,
          "duration_ticks": 480,
          "velocity": 88
        },
        {
          "id": "ps1650.tune.selma.harmony.alto.note-08",
          "midi": 63,
          "start_tick": 4320,
          "duration_ticks": 480,
          "velocity": 88
        },
        {
          "id": "ps1650.tune.selma.harmony.alto.note-09",
          "midi": 63,
          "start_tick": 4800,
          "duration_ticks": 480,
          "velocity": 88
        },
        {
          "id": "ps1650.tune.selma.harmony.alto.note-10",
          "midi": 63,
          "start_tick": 5280,
          "duration_ticks": 480,
          "velocity": 88
        },
        {
          "id": "ps1650.tune.selma.harmony.alto.note-11",
          "midi": 62,
          "start_tick": 5760,
          "duration_ticks": 360,
          "velocity": 88
        },
        {
          "id": "ps1650.tune.selma.harmony.alto.note-12",
          "midi": 60,
          "start_tick": 6120,
          "duration_ticks": 120,
          "velocity": 88
        },
        {
          "id": "ps1650.tune.selma.harmony.alto.note-13",
          "midi": 60,
          "start_tick": 6240,
          "duration_ticks": 1440,
          "velocity": 88
        },
        {
          "id": "ps1650.tune.selma.harmony.alto.note-14",
          "midi": 63,
          "start_tick": 7680,
          "duration_ticks": 480,
          "velocity": 88
        },
        {
          "id": "ps1650.tune.selma.harmony.alto.note-15",
          "midi": 70,
          "start_tick": 8160,
          "duration_ticks": 480,
          "velocity": 88
        },
        {
          "id": "ps1650.tune.selma.harmony.alto.note-16",